{
  "schema_version": 2,
  "squad_goal_ref": ".squad/goal.md",
  "execution_mode": "one-time",
  "created": "1970-01-01T00:00:00Z",
  "roles": [
    {
      "id": "example-role-delete-me",
      "purpose": "Produce one specific artifact for the squad goal",
      "description": "Use when the squad needs the example artifact produced",
      "file_ownership": {
        "include": [
          "path/the/role/owns/**",
          ".squad/workspaces/example-role-delete-me/**"
        ],
        "exclude": []
      },
      "capabilities": [
        "filesystem.read",
        "filesystem.write",
        "shell.execute"
      ],
      "reasoning": {
        "profile": "balanced",
        "effort": "high"
      },
      "active": false,
      "goal_ref": ".squad/role-goal-example-role-delete-me.md",
      "environment": {
        "workspace": ".squad/workspaces/example-role-delete-me",
        "directories": [
          "inputs",
          "outputs",
          "scratch"
        ],
        "variables": {
          "EXAMPLE_VAR": "non-secret-example-value"
        },
        "context": [
          {
            "source": "path/to/local/reference",
            "target": "inputs",
            "kind": "copy"
          }
        ],
        "tools": [
          {
            "name": "jq",
            "kind": "system",
            "verify": "command -v jq"
          },
          {
            "name": "csvkit",
            "kind": "local",
            "install": "pip install --target lib csvkit",
            "verify": "test -d lib/csvkit"
          }
        ]
      },
      "provider_overrides": {
        "claude": {
          "model": "sonnet",
          "tools": [
            "Read",
            "Write",
            "Bash"
          ],
          "agent_file": ".claude/agents/example-role-delete-me.md",
          "isolation": "worktree"
        }
      },
      "created": "1970-01-01T00:00:00Z"
    }
  ]
}
